f692cb80 3164329835 S Co:4:009:0 s 40 0c 0000 0471 1000 4096 = 3c6d1fc3 be9f02b4 facf1b2f 315d1788 e244e283 1e19cad3 3ecc57ff 1654e1fd
f692cb80 3164333115 C Co:4:009:0 0 4096 >
f692cb80 3164333199 S Co:4:009:0 s 40 0c 0000 0471 1000 4096 = 2b841627 27d63d57 ce2a6d89 17b60441 42c43780 07c72f28 ecd8220e 33a8d9b1
f692cb80 3164336482 C Co:4:009:0 0 4096 >
f692cb80 3164336554 S Co:4:009:0 s 40 0c 0000 0471 0802 2050 = ba126bcd c009b5d0 aabcda47 70b2e516 42f36f21 802d9a86 0e7f356a c32e675e
f692cb80 3164517112 C Co:4:009:0 0 2050 >
f692cb80 3164529309 S Co:4:009:0 s 40 0c 0000 0472 1000 4096 = bdd60d10 3e9f9dbb b8637585 d8501f98 ff0cf236 0550c8bb 3fecddbd 0685fab7
f692cb80 3164532610 C Co:4:009:0 0 4096 >
f692cb80 3164532639 S Co:4:009:0 s 40 0c 0000 0472 1000 4096 = 2fb69375 2236cc4c e96aac94 e8f5c0b8 0b7930b8 177acd21 9c0b59ac 28abf478
f692cb80 3164535983 C Co:4:009:0 0 4096 >
f692cb80 3164536009 S Co:4:009:0 s 40 0c 0000 0472 1000 4096 = 24737745 35b042a2 bc17f7be 8e45e31c da9cf016 c81d0e93 ce82cba0 87b420f3
f692cb80 3164539359 C Co:4:009:0 0 4096 >
f692cb80 3164539384 S Co:4:009:0 s 40 0c 0000 0472 1000 4096 = f51b92ba 779f0bc2 7a542509 f24018ce fa67507f a6404547 a9ef4ef9 fe665a4f
f692cb80 3164542735 C Co:4:009:0 0 4096 >
f692cb80 3164542761 S Co:4:009:0 s 40 0c 0000 0472 1000 4096 = 3e4515c3 d80b75d8 3b217ffa 6dd4938b dcfd485a 0abc22b2 d2ae6d93 4deffefa
f692cb80 3164546109 C Co:4:009:0 0 4096 >
f692cb80 3164546135 S Co:4:009:0 s 40 0c 0000 0472 1000 4096 = 4ac3db3d 84abb0b4 fa7b3e6f a393fa2d 335df2ef 62f41467 99d85770 f1317709
f692cb80 3164549360 C Co:4:009:0 0 4096 >
f692cb80 3164549429 S Co:4:009:0 s 40 0c 0000 0472 1000 4096 = 08e39dbb 7f751605 73425824 47c90939 d33b9793 ad7fbe1f aa1d7c81 7451fca9
f692cb80 3164552735 C Co:4:009:0 0 4096 >
f692cb80 3164552761 S Co:4:009:0 s 40 0c 0000 0472 1000 4096 = b52ca123 4526c25a 886512dc 15bef601 e2fdf88b d831daa3 b20f9102 2dde3c5d
f692cb80 3164556109 C Co:4:009:0 0 4096 >
f692cb80 3164556176 S Co:4:009:0 s 40 0c 0000 0472 1000 4096 = 398b3af5 b4397717 ae3381e5 ea70ab07 d0e34bc9 c02f2bbf 64f8a849 9e698cf3
f692cb80 3164559483 C Co:4:009:0 0 4096 >
f692cb80 3164559552 S Co:4:009:0 s 40 0c 0000 0472 1000 4096 = fb75aa0e 4983ba7a 4a5c3b0e ebb1c317 86b08d8b f6d07b84 414562c7 ce0f34ae
f692cb80 3164562860 C Co:4:009:0 0 4096 >
f692cb80 3164562929 S Co:4:009:0 s 40 0c 0000 0472 1000 4096 = 236e8704 7723736a 8e9cac4c 3283121e adf7068c 890d3f00 f5a4b4c0 5228f7f2
f692cb80 3164566234 C Co:4:009:0 0 4096 >
f692cb80 3164566302 S Co:4:009:0 s 40 0c 0000 0472 1000 4096 = d9d4194f c2ce5e90 82c8e0c7 a8090e49 6724d292 5d4e43b2 48da5233 12228fa5
f692cb80 3164569608 C Co:4:009:0 0 4096 >
f692cb80 3164569681 S Co:4:009:0 s 40 0c 0000 0472 1000 4096 = 91ccfaa0 918ff875 fa250a9e 088b5dce 82c6df14 eef068a8 20a895d4 b328ff6f
f692cb80 3164572984 C Co:4:009:0 0 4096 >
f692cb80 3164573010 S Co:4:009:0 s 40 0c 0000 0472 1000 4096 = 90cedfa7 4b8b65bb d5dad47f 5010bb7e 2d55160c f1c52e5e 8e959dd6 5be6d001
f692cb80 3164576357 C Co:4:009:0 0 4096 >
f692cb80 3164576379 S Co:4:009:0 s 40 0c 0000 0472 0802 2050 = 375be005 147ecadb c0dc41df b4ef58d6 a1e6d2e1 71a22208 7332d28d 09e96da4
f692cb80 3164937237 C Co:4:009:0 0 2050 >
f6c231c0 3164947374 C Ii:4:001:1 0:2048 2 = 2000
f6c231c0 3164947386 S Ii:4:001:1 -115:2048 4 <
f692cb80 3164947398 S Ci:4:001:0 s a3 00 0000 0005 0004 4 <
f692cb80 3164947417 C Ci:4:001:0 0 4 = 00010100
f692cb80 3164947424 S Co:4:001:0 s 23 01 0010 0005 0000 0
f692cb80 3164947431 C Co:4:001:0 0 0
f692cb80 3164947755 S Ci:4:001:0 s a3 00 0000 0005 0004 4 <
f692cb80 3164947766 C Ci:4:001:0 0 4 = 00010000
f18a1700 3164976631 S Ci:4:001:0 s a3 00 0000 0005 0004 4 <
f18a1700 3164976646 C Ci:4:001:0 0 4 = 00010000
f18a1640 3165008671 S Ci:4:001:0 s a3 00 0000 0005 0004 4 <
f18a1640 3165008696 C Ci:4:001:0 0 4 = 00010000
f692cb80 3165040624 S Ci:4:001:0 s a3 00 0000 0005 0004 4 <
f692cb80 3165040636 C Ci:4:001:0 0 4 = 00010000
f18a1640 3165072625 S Ci:4:001:0 s a3 00 0000 0005 0004 4 <
f18a1640 3165072638 C Ci:4:001:0 0 4 = 00010000
f6c231c0 3165073112 C Ii:4:001:1 -2:2048 0
f692cb80 3165598785 S Ci:4:001:0 s a3 00 0000 0001 0004 4 <
f692cb80 3165598801 C Ci:4:001:0 0 4 = 00010000
f692cb80 3165598807 S Ci:4:001:0 s a3 00 0000 0002 0004 4 <
f692cb80 3165598813 C Ci:4:001:0 0 4 = 00010000
f692cb80 3165598817 S Ci:4:001:0 s a3 00 0000 0003 0004 4 <
f692cb80 3165598822 C Ci:4:001:0 0 4 = 00010000
f692cb80 3165598827 S Ci:4:001:0 s a3 00 0000 0004 0004 4 <
f692cb80 3165598837 C Ci:4:001:0 0 4 = 00010000
f692cb80 3165598841 S Ci:4:001:0 s a3 00 0000 0005 0004 4 <
f692cb80 3165598849 C Ci:4:001:0 0 4 = 01050100
f692cb80 3165598852 S Co:4:001:0 s 23 01 0010 0005 0000 0
f692cb80 3165598858 C Co:4:001:0 0 0
f692cb80 3165598861 S Ci:4:001:0 s a3 00 0000 0006 0004 4 <
f692cb80 3165598865 C Ci:4:001:0 0 4 = 00010000
f692cb80 3165598868 S Ci:4:001:0 s a3 00 0000 0007 0004 4 <
f692cb80 3165598872 C Ci:4:001:0 0 4 = 00010000
f692cb80 3165598875 S Ci:4:001:0 s a3 00 0000 0008 0004 4 <
f692cb80 3165598879 C Ci:4:001:0 0 4 = 00010000
f6c231c0 3165700625 S Ii:4:001:1 -115:2048 4 <
f692cb80 3165700655 S Ci:4:001:0 s a3 00 0000 0005 0004 4 <
f692cb80 3165700669 C Ci:4:001:0 0 4 = 01050000
f692cb80 3165700683 S Co:4:001:0 s 23 03 0004 0005 0000 0
f692cb80 3165700690 C Co:4:001:0 0 0
f4121700 3165756625 S Ci:4:001:0 s a3 00 0000 0005 0004 4 <
f4121700 3165756935 C Ci:4:001:0 0 4 = 03051000
f692cb80 3165812626 S Co:4:001:0 s 23 01 0014 0005 0000 0
f692cb80 3165812637 C Co:4:001:0 0 0
f692cb80 3165812657 S Ci:4:000:0 s 80 06 0100 0000 0040 64 <
f692cb80 3165812795 C Ci:4:000:0 0 18 = 12010002 00000040 07220a30 00010000 0001
f692cb80 3165812806 S Co:4:001:0 s 23 03 0004 0005 0000 0
f692cb80 3165812814 C Co:4:001:0 0 0
f4121700 3165868624 S Ci:4:001:0 s a3 00 0000 0005 0004 4 <
f4121700 3165868917 C Ci:4:001:0 0 4 = 03051000
f692cb80 3165924627 S Co:4:001:0 s 23 01 0014 0005 0000 0
f692cb80 3165924639 C Co:4:001:0 0 0
f692cb80 3165924646 S Co:4:000:0 s 00 05 000a 0000 0000 0
f692cb80 3165924791 C Co:4:000:0 0 0
f692cb80 3165944625 S Ci:4:010:0 s 80 06 0100 0000 0012 18 <
f692cb80 3165944791 C Ci:4:010:0 0 18 = 12010002 00000040 07220a30 00010000 0001
f692cb80 3165944809 S Ci:4:010:0 s 80 06 0200 0000 0009 9 <
f692cb80 3165944914 C Ci:4:010:0 0 9 = 09022000 01010080 c8
f692cb80 3165944924 S Ci:4:010:0 s 80 06 0200 0000 0020 32 <
f692cb80 3165945039 C Ci:4:010:0 0 32 = 09022000 01010080 c8090400 0002ff06 05000705 81020002 00070502 02000200
f4121700 3165945282 S Co:4:010:0 s 00 09 0001 0000 0000 0
f4121700 3165945416 C Co:4:010:0 0 0
