f692cb80 3164329835 S Co:4:009:0 s 40 0c 0000 0471 1000 4096 = 3c6d1fc3 be9f02b4 facf1b2f 315d1788 e244e283 1e19cad3 3ecc57ff 1654e1fd
f692cb80 3164333199 S Co:4:009:0 s 40 0c 0000 0471 1000 4096 = 2b841627 27d63d57 ce2a6d89 17b60441 42c43780 07c72f28 ecd8220e 33a8d9b1
f692cb80 3164336554 S Co:4:009:0 s 40 0c 0000 0471 0802 2050 = ba126bcd c009b5d0 aabcda47 70b2e516 42f36f21 802d9a86 0e7f356a c32e675e
f692cb80 3164529309 S Co:4:009:0 s 40 0c 0000 0472 1000 4096 = bdd60d10 3e9f9dbb b8637585 d8501f98 ff0cf236 0550c8bb 3fecddbd 0685fab7
f692cb80 3164532639 S Co:4:009:0 s 40 0c 0000 0472 1000 4096 = 2fb69375 2236cc4c e96aac94 e8f5c0b8 0b7930b8 177acd21 9c0b59ac 28abf478
f692cb80 3164536009 S Co:4:009:0 s 40 0c 0000 0472 1000 4096 = 24737745 35b042a2 bc17f7be 8e45e31c da9cf016 c81d0e93 ce82cba0 87b420f3
f692cb80 3164539384 S Co:4:009:0 s 40 0c 0000 0472 1000 4096 = f51b92ba 779f0bc2 7a542509 f24018ce fa67507f a6404547 a9ef4ef9 fe665a4f
f692cb80 3164542761 S Co:4:009:0 s 40 0c 0000 0472 1000 4096 = 3e4515c3 d80b75d8 3b217ffa 6dd4938b dcfd485a 0abc22b2 d2ae6d93 4deffefa
f692cb80 3164546135 S Co:4:009:0 s 40 0c 0000 0472 1000 4096 = 4ac3db3d 84abb0b4 fa7b3e6f a393fa2d 335df2ef 62f41467 99d85770 f1317709
f692cb80 3164549429 S Co:4:009:0 s 40 0c 0000 0472 1000 4096 = 08e39dbb 7f751605 73425824 47c90939 d33b9793 ad7fbe1f aa1d7c81 7451fca9
f692cb80 3164552761 S Co:4:009:0 s 40 0c 0000 0472 1000 4096 = b52ca123 4526c25a 886512dc 15bef601 e2fdf88b d831daa3 b20f9102 2dde3c5d
f692cb80 3164556176 S Co:4:009:0 s 40 0c 0000 0472 1000 4096 = 398b3af5 b4397717 ae3381e5 ea70ab07 d0e34bc9 c02f2bbf 64f8a849 9e698cf3
f692cb80 3164559552 S Co:4:009:0 s 40 0c 0000 0472 1000 4096 = fb75aa0e 4983ba7a 4a5c3b0e ebb1c317 86b08d8b f6d07b84 414562c7 ce0f34ae
f692cb80 3164562929 S Co:4:009:0 s 40 0c 0000 0472 1000 4096 = 236e8704 7723736a 8e9cac4c 3283121e adf7068c 890d3f00 f5a4b4c0 5228f7f2
f692cb80 3164566302 S Co:4:009:0 s 40 0c 0000 0472 1000 4096 = d9d4194f c2ce5e90 82c8e0c7 a8090e49 6724d292 5d4e43b2 48da5233 12228fa5
f692cb80 3164569681 S Co:4:009:0 s 40 0c 0000 0472 1000 4096 = 91ccfaa0 918ff875 fa250a9e 088b5dce 82c6df14 eef068a8 20a895d4 b328ff6f
f692cb80 3164573010 S Co:4:009:0 s 40 0c 0000 0472 1000 4096 = 90cedfa7 4b8b65bb d5dad47f 5010bb7e 2d55160c f1c52e5e 8e959dd6 5be6d001
f692cb80 3164576379 S Co:4:009:0 s 40 0c 0000 0472 0802 2050 = 375be005 147ecadb c0dc41df b4ef58d6 a1e6d2e1 71a22208 7332d28d 09e96da4

